{
	"$schema": "../../.schemas/content-entry.schema.json",
	"id": "pages:home",
	"slug": "home",
	"status": "published",
	"data": {
		"title": "Home",
		"content": [
			{
				"_type": "marketing.hero",
				"_key": "hero",
				"headline": "Build products people actually want",
				"subheadline": "The all-in-one platform for modern teams. Ship faster, collaborate better, and focus on what matters.",
				"primaryCtaLabel": "Start Free Trial",
				"primaryCtaUrl": "/signup",
				"secondaryCtaLabel": "Watch Demo",
				"secondaryCtaUrl": "/demo"
			},
			{
				"_type": "marketing.features",
				"_key": "features",
				"headline": "Everything you need to ship",
				"subheadline": "Powerful features that help your team move faster without sacrificing quality.",
				"features": [
					{
						"icon": "zap",
						"title": "Lightning Fast",
						"description": "Built for speed from the ground up. Your team will notice the difference from day one."
					},
					{
						"icon": "shield",
						"title": "Enterprise Security",
						"description": "SOC 2 compliant with end-to-end encryption. Your data stays yours."
					},
					{
						"icon": "users",
						"title": "Team Collaboration",
						"description": "Real-time collaboration features that make working together feel effortless."
					},
					{
						"icon": "chart",
						"title": "Powerful Analytics",
						"description": "Understand how your team works with detailed insights and reporting."
					},
					{
						"icon": "code",
						"title": "Developer Friendly",
						"description": "A robust API and CLI tools that integrate with your existing workflow."
					},
					{
						"icon": "globe",
						"title": "Global Scale",
						"description": "Deployed to edge locations worldwide. Fast for everyone, everywhere."
					}
				]
			},
			{
				"_type": "marketing.testimonials",
				"_key": "testimonials",
				"headline": "Trusted by teams everywhere",
				"testimonials": [
					{
						"quote": "We cut our deployment time by 80%. The team actually enjoys shipping now.",
						"author": "Sarah Chen",
						"role": "CTO",
						"company": "Streamline"
					},
					{
						"quote": "The best developer experience I've used. Everything just works the way you'd expect.",
						"author": "Marcus Johnson",
						"role": "Lead Engineer",
						"company": "Volt Labs"
					},
					{
						"quote": "Finally, a tool that doesn't get in the way. Our team is more productive than ever.",
						"author": "Elena Rodriguez",
						"role": "VP Engineering",
						"company": "Nexus"
					}
				]
			},
			{
				"_type": "marketing.faq",
				"_key": "faq",
				"headline": "Frequently asked questions",
				"items": [
					{
						"question": "How long does setup take?",
						"answer": "Most teams are up and running in under 15 minutes. Our onboarding wizard guides you through connecting your existing tools and inviting your team."
					},
					{
						"question": "Can I migrate from my current tool?",
						"answer": "Yes. We have built-in importers for all major platforms, and our support team can help with custom migrations for larger teams."
					},
					{
						"question": "What kind of support do you offer?",
						"answer": "All plans include email support with a 24-hour response time. Pro and Enterprise plans include priority support with dedicated account managers."
					},
					{
						"question": "Is there a free trial?",
						"answer": "Yes, all plans come with a 14-day free trial. No credit card required. You can upgrade, downgrade, or cancel at any time."
					}
				]
			}
		]
	}
}
